No.     Time        Source                Destination           Protocol Length Info
      1 0.000000    Apple_04:d9:e6        Broadcast             ARP      56     Gratuitous ARP for 172.24.20.226 (Request)

Frame 1: 56 bytes on wire (448 bits), 56 bytes captured (448 bits)
Ethernet II, Src: Apple_04:d9:e6 (10:1c:0c:04:d9:e6), Dst: Broadcast (ff:ff:ff:ff:ff:ff)
Address Resolution Protocol (request/gratuitous ARP)

No.     Time        Source                Destination           Protocol Length Info
      2 6.484553    Apple_3f:7f:24        Broadcast             ARP      56     Gratuitous ARP for 172.24.25.105 (Request)

Frame 2: 56 bytes on wire (448 bits), 56 bytes captured (448 bits)
Ethernet II, Src: Apple_3f:7f:24 (50:ea:d6:3f:7f:24), Dst: Broadcast (ff:ff:ff:ff:ff:ff)
Address Resolution Protocol (request/gratuitous ARP)

No.     Time        Source                Destination           Protocol Length Info
      3 6.546431    Apple_68:76:c8        Broadcast             ARP      56     Gratuitous ARP for 172.24.30.111 (Request)

Frame 3: 56 bytes on wire (448 bits), 56 bytes captured (448 bits)
Ethernet II, Src: Apple_68:76:c8 (90:b9:31:68:76:c8), Dst: Broadcast (ff:ff:ff:ff:ff:ff)
Address Resolution Protocol (request/gratuitous ARP)

No.     Time        Source                Destination           Protocol Length Info
      4 7.700053    Apple_10:fd:fc        Broadcast             ARP      56     Gratuitous ARP for 172.24.17.147 (Request)

Frame 4: 56 bytes on wire (448 bits), 56 bytes captured (448 bits)
Ethernet II, Src: Apple_10:fd:fc (34:e2:fd:10:fd:fc), Dst: Broadcast (ff:ff:ff:ff:ff:ff)
Address Resolution Protocol (request/gratuitous ARP)

No.     Time        Source                Destination           Protocol Length Info
      5 9.096857    Apple_10:fd:fc        Broadcast             ARP      56     Gratuitous ARP for 172.24.17.147 (Request)

Frame 5: 56 bytes on wire (448 bits), 56 bytes captured (448 bits)
Ethernet II, Src: Apple_10:fd:fc (34:e2:fd:10:fd:fc), Dst: Broadcast (ff:ff:ff:ff:ff:ff)
Address Resolution Protocol (request/gratuitous ARP)

No.     Time        Source                Destination           Protocol Length Info
      6 13.721979   Apple_10:fd:fc        Broadcast             ARP      56     Gratuitous ARP for 172.24.17.147 (Request)

Frame 6: 56 bytes on wire (448 bits), 56 bytes captured (448 bits)
Ethernet II, Src: Apple_10:fd:fc (34:e2:fd:10:fd:fc), Dst: Broadcast (ff:ff:ff:ff:ff:ff)
Address Resolution Protocol (request/gratuitous ARP)

No.     Time        Source                Destination           Protocol Length Info
      7 14.347531   SeikoEps_07:52:f5     Broadcast             ARP      60     Gratuitous ARP for 172.24.17.134 (Request)

Frame 7: 60 bytes on wire (480 bits), 60 bytes captured (480 bits)
Ethernet II, Src: SeikoEps_07:52:f5 (b0:e8:92:07:52:f5), Dst: Broadcast (ff:ff:ff:ff:ff:ff)
Address Resolution Protocol (request/gratuitous ARP)

No.     Time        Source                Destination           Protocol Length Info
      8 23.446988   SeikoEps_db:ca:33     Broadcast             ARP      60     Gratuitous ARP for 172.24.27.129 (Request)

Frame 8: 60 bytes on wire (480 bits), 60 bytes captured (480 bits)
Ethernet II, Src: SeikoEps_db:ca:33 (ac:18:26:db:ca:33), Dst: Broadcast (ff:ff:ff:ff:ff:ff)
Address Resolution Protocol (request/gratuitous ARP)

No.     Time        Source                Destination           Protocol Length Info
      9 24.695993   172.24.31.204         130.245.255.4         DNS      69     Standard query 0xb040  A alexa.com

Frame 9: 69 bytes on wire (552 bits), 69 bytes captured (552 bits)
Ethernet II, Src: 30:10:b3:12:c8:2f (30:10:b3:12:c8:2f), Dst: Hewlett-_63:a3:28 (b8:af:67:63:a3:28)
Internet Protocol Version 4, Src: 172.24.31.204 (172.24.31.204), Dst: 130.245.255.4 (130.245.255.4)
User Datagram Protocol, Src Port: 54474 (54474), Dst Port: domain (53)
Domain Name System (query)
    [Response In: 216]
    Transaction ID: 0xb040
    Flags: 0x0100 Standard query
    Questions: 1
    Answer RRs: 0
    Authority RRs: 0
    Additional RRs: 0
    Queries

No.     Time        Source                Destination           Protocol Length Info
     10 24.696081   172.24.31.204         130.245.255.4         DNS      73     Standard query 0x8ec2  A www.alexa.com

Frame 10: 73 bytes on wire (584 bits), 73 bytes captured (584 bits)
Ethernet II, Src: 30:10:b3:12:c8:2f (30:10:b3:12:c8:2f), Dst: Hewlett-_63:a3:28 (b8:af:67:63:a3:28)
Internet Protocol Version 4, Src: 172.24.31.204 (172.24.31.204), Dst: 130.245.255.4 (130.245.255.4)
User Datagram Protocol, Src Port: 9308 (9308), Dst Port: domain (53)
Domain Name System (query)
    [Response In: 244]
    Transaction ID: 0x8ec2
    Flags: 0x0100 Standard query
    Questions: 1
    Answer RRs: 0
    Authority RRs: 0
    Additional RRs: 0
    Queries

No.     Time        Source                Destination           Protocol Length Info
     11 24.696158   172.24.31.204         130.245.255.4         DNS      75     Standard query 0xce43  A apis.google.com

Frame 11: 75 bytes on wire (600 bits), 75 bytes captured (600 bits)
Ethernet II, Src: 30:10:b3:12:c8:2f (30:10:b3:12:c8:2f), Dst: Hewlett-_63:a3:28 (b8:af:67:63:a3:28)
Internet Protocol Version 4, Src: 172.24.31.204 (172.24.31.204), Dst: 130.245.255.4 (130.245.255.4)
User Datagram Protocol, Src Port: 32441 (32441), Dst Port: domain (53)
Domain Name System (query)
    [Response In: 12]
    Transaction ID: 0xce43
    Flags: 0x0100 Standard query
    Questions: 1
    Answer RRs: 0
    Authority RRs: 0
    Additional RRs: 0
    Queries

No.     Time        Source                Destination           Protocol Length Info
     12 24.733523   130.245.255.4         172.24.31.204         DNS      272    Standard query response 0xce43  CNAME plus.l.google.com A 173.194.123.71 A 173.194.123.65 A 173.194.123.67 A 173.194.123.73 A 173.194.123.64 A 173.194.123.70 A 173.194.123.72 A 173.194.123.78 A 173.194.123.68 A 173.194.123.69 A 173.194.123.66

Frame 12: 272 bytes on wire (2176 bits), 272 bytes captured (2176 bits)
Ethernet II, Src: Hewlett-_63:a3:28 (b8:af:67:63:a3:28), Dst: 30:10:b3:12:c8:2f (30:10:b3:12:c8:2f)
Internet Protocol Version 4, Src: 130.245.255.4 (130.245.255.4), Dst: 172.24.31.204 (172.24.31.204)
User Datagram Protocol, Src Port: domain (53), Dst Port: 32441 (32441)
Domain Name System (response)
    [Request In: 11]
    [Time: 0.037365000 seconds]
    Transaction ID: 0xce43
    Flags: 0x8180 Standard query response, No error
    Questions: 1
    Answer RRs: 12
    Authority RRs: 0
    Additional RRs: 0
    Queries
    Answers

No.     Time        Source                Destination           Protocol Length Info
     13 24.734875   172.24.31.204         130.245.255.4         DNS      79     Standard query 0x1ca5  A clients5.google.com

Frame 13: 79 bytes on wire (632 bits), 79 bytes captured (632 bits)
Ethernet II, Src: 30:10:b3:12:c8:2f (30:10:b3:12:c8:2f), Dst: Hewlett-_63:a3:28 (b8:af:67:63:a3:28)
Internet Protocol Version 4, Src: 172.24.31.204 (172.24.31.204), Dst: 130.245.255.4 (130.245.255.4)
User Datagram Protocol, Src Port: 53610 (53610), Dst Port: domain (53)
Domain Name System (query)
    [Response In: 14]
    Transaction ID: 0x1ca5
    Flags: 0x0100 Standard query
    Questions: 1
    Answer RRs: 0
    Authority RRs: 0
    Additional RRs: 0
    Queries

No.     Time        Source                Destination           Protocol Length Info
     14 24.736628   130.245.255.4         172.24.31.204         DNS      279    Standard query response 0x1ca5  CNAME clients.l.google.com A 173.194.123.67 A 173.194.123.68 A 173.194.123.64 A 173.194.123.78 A 173.194.123.66 A 173.194.123.73 A 173.194.123.69 A 173.194.123.65 A 173.194.123.71 A 173.194.123.72 A 173.194.123.70

Frame 14: 279 bytes on wire (2232 bits), 279 bytes captured (2232 bits)
Ethernet II, Src: Hewlett-_63:a3:28 (b8:af:67:63:a3:28), Dst: 30:10:b3:12:c8:2f (30:10:b3:12:c8:2f)
Internet Protocol Version 4, Src: 130.245.255.4 (130.245.255.4), Dst: 172.24.31.204 (172.24.31.204)
User Datagram Protocol, Src Port: domain (53), Dst Port: 53610 (53610)
Domain Name System (response)
    [Request In: 13]
    [Time: 0.001753000 seconds]
    Transaction ID: 0x1ca5
    Flags: 0x8180 Standard query response, No error
    Questions: 1
    Answer RRs: 12
    Authority RRs: 0
    Additional RRs: 0
    Queries
    Answers

No.     Time        Source                Destination           Protocol Length Info
     15 24.736959   172.24.31.204         130.245.255.4         DNS      73     Standard query 0x76e0  A getpocket.com

Frame 15: 73 bytes on wire (584 bits), 73 bytes captured (584 bits)
Ethernet II, Src: 30:10:b3:12:c8:2f (30:10:b3:12:c8:2f), Dst: Hewlett-_63:a3:28 (b8:af:67:63:a3:28)
Internet Protocol Version 4, Src: 172.24.31.204 (172.24.31.204), Dst: 130.245.255.4 (130.245.255.4)
User Datagram Protocol, Src Port: 56702 (56702), Dst Port: domain (53)
Domain Name System (query)
    [Response In: 16]
    Transaction ID: 0x76e0
    Flags: 0x0100 Standard query
    Questions: 1
    Answer RRs: 0
    Authority RRs: 0
    Additional RRs: 0
    Queries

No.     Time        Source                Destination           Protocol Length Info
     16 24.764719   130.245.255.4         172.24.31.204         DNS      89     Standard query response 0x76e0  A 23.21.51.202

Frame 16: 89 bytes on wire (712 bits), 89 bytes captured (712 bits)
Ethernet II, Src: Hewlett-_63:a3:28 (b8:af:67:63:a3:28), Dst: 30:10:b3:12:c8:2f (30:10:b3:12:c8:2f)
Internet Protocol Version 4, Src: 130.245.255.4 (130.245.255.4), Dst: 172.24.31.204 (172.24.31.204)
User Datagram Protocol, Src Port: domain (53), Dst Port: 56702 (56702)
Domain Name System (response)
    [Request In: 15]
    [Time: 0.027760000 seconds]
    Transaction ID: 0x76e0
    Flags: 0x8180 Standard query response, No error
    Questions: 1
    Answer RRs: 1
    Authority RRs: 0
    Additional RRs: 0
    Queries
    Answers

No.     Time        Source                Destination           Protocol Length Info
     17 24.765029   172.24.31.204         130.245.255.4         DNS      85     Standard query 0x734b  A lh3.googleusercontent.com

Frame 17: 85 bytes on wire (680 bits), 85 bytes captured (680 bits)
Ethernet II, Src: 30:10:b3:12:c8:2f (30:10:b3:12:c8:2f), Dst: Hewlett-_63:a3:28 (b8:af:67:63:a3:28)
Internet Protocol Version 4, Src: 172.24.31.204 (172.24.31.204), Dst: 130.245.255.4 (130.245.255.4)
User Datagram Protocol, Src Port: 61736 (61736), Dst Port: domain (53)
Domain Name System (query)
    [Response In: 18]
    Transaction ID: 0x734b
    Flags: 0x0100 Standard query
    Questions: 1
    Answer RRs: 0
    Authority RRs: 0
    Additional RRs: 0
    Queries

No.     Time        Source                Destination           Protocol Length Info
     18 24.768313   130.245.255.4         172.24.31.204         DNS      162    Standard query response 0x734b  CNAME googlehosted.l.googleusercontent.com A 173.194.123.76 A 173.194.123.75 A 173.194.123.74

Frame 18: 162 bytes on wire (1296 bits), 162 bytes captured (1296 bits)
Ethernet II, Src: Hewlett-_63:a3:28 (b8:af:67:63:a3:28), Dst: 30:10:b3:12:c8:2f (30:10:b3:12:c8:2f)
Internet Protocol Version 4, Src: 130.245.255.4 (130.245.255.4), Dst: 172.24.31.204 (172.24.31.204)
User Datagram Protocol, Src Port: domain (53), Dst Port: 61736 (61736)
Domain Name System (response)
    [Request In: 17]
    [Time: 0.003284000 seconds]
    Transaction ID: 0x734b
    Flags: 0x8180 Standard query response, No error
    Questions: 1
    Answer RRs: 4
    Authority RRs: 0
    Additional RRs: 0
    Queries
    Answers

No.     Time        Source                Destination           Protocol Length Info
     19 24.768656   172.24.31.204         130.245.255.4         DNS      75     Standard query 0x5485  A plus.google.com

Frame 19: 75 bytes on wire (600 bits), 75 bytes captured (600 bits)
Ethernet II, Src: 30:10:b3:12:c8:2f (30:10:b3:12:c8:2f), Dst: Hewlett-_63:a3:28 (b8:af:67:63:a3:28)
Internet Protocol Version 4, Src: 172.24.31.204 (172.24.31.204), Dst: 130.245.255.4 (130.245.255.4)
User Datagram Protocol, Src Port: 62710 (62710), Dst Port: domain (53)
Domain Name System (query)
    [Response In: 20]
    Transaction ID: 0x5485
    Flags: 0x0100 Standard query
    Questions: 1
    Answer RRs: 0
    Authority RRs: 0
    Additional RRs: 0
    Queries

No.     Time        Source                Destination           Protocol Length Info
     20 24.770639   130.245.255.4         172.24.31.204         DNS      251    Standard query response 0x5485  A 173.194.123.65 A 173.194.123.68 A 173.194.123.73 A 173.194.123.69 A 173.194.123.71 A 173.194.123.78 A 173.194.123.72 A 173.194.123.70 A 173.194.123.66 A 173.194.123.64 A 173.194.123.67

Frame 20: 251 bytes on wire (2008 bits), 251 bytes captured (2008 bits)
Ethernet II, Src: Hewlett-_63:a3:28 (b8:af:67:63:a3:28), Dst: 30:10:b3:12:c8:2f (30:10:b3:12:c8:2f)
Internet Protocol Version 4, Src: 130.245.255.4 (130.245.255.4), Dst: 172.24.31.204 (172.24.31.204)
User Datagram Protocol, Src Port: domain (53), Dst Port: 62710 (62710)
Domain Name System (response)
    [Request In: 19]
    [Time: 0.001983000 seconds]
    Transaction ID: 0x5485
    Flags: 0x8180 Standard query response, No error
    Questions: 1
    Answer RRs: 11
    Authority RRs: 0
    Additional RRs: 0
    Queries
    Answers

No.     Time        Source                Destination           Protocol Length Info
     21 24.771419   172.24.31.204         130.245.255.4         DNS      75     Standard query 0x8cf4  A ssl.gstatic.com

Frame 21: 75 bytes on wire (600 bits), 75 bytes captured (600 bits)
Ethernet II, Src: 30:10:b3:12:c8:2f (30:10:b3:12:c8:2f), Dst: Hewlett-_63:a3:28 (b8:af:67:63:a3:28)
Internet Protocol Version 4, Src: 172.24.31.204 (172.24.31.204), Dst: 130.245.255.4 (130.245.255.4)
User Datagram Protocol, Src Port: 34628 (34628), Dst Port: domain (53)
Domain Name System (query)
    [Response In: 22]
    Transaction ID: 0x8cf4
    Flags: 0x0100 Standard query
    Questions: 1
    Answer RRs: 0
    Authority RRs: 0
    Additional RRs: 0
    Queries

No.     Time        Source                Destination           Protocol Length Info
     22 24.773607   130.245.255.4         172.24.31.204         DNS      139    Standard query response 0x8cf4  A 173.194.123.79 A 173.194.123.88 A 173.194.123.87 A 173.194.123.95

Frame 22: 139 bytes on wire (1112 bits), 139 bytes captured (1112 bits)
Ethernet II, Src: Hewlett-_63:a3:28 (b8:af:67:63:a3:28), Dst: 30:10:b3:12:c8:2f (30:10:b3:12:c8:2f)
Internet Protocol Version 4, Src: 130.245.255.4 (130.245.255.4), Dst: 172.24.31.204 (172.24.31.204)
User Datagram Protocol, Src Port: domain (53), Dst Port: 34628 (34628)
Domain Name System (response)
    [Request In: 21]
    [Time: 0.002188000 seconds]
    Transaction ID: 0x8cf4
    Flags: 0x8180 Standard query response, No error
    Questions: 1
    Answer RRs: 4
    Authority RRs: 0
    Additional RRs: 0
    Queries
    Answers

No.     Time        Source                Destination           Protocol Length Info
     23 24.773876   172.24.31.204         130.245.255.4         DNS      74     Standard query 0x8db2  A www.google.com

Frame 23: 74 bytes on wire (592 bits), 74 bytes captured (592 bits)
Ethernet II, Src: 30:10:b3:12:c8:2f (30:10:b3:12:c8:2f), Dst: Hewlett-_63:a3:28 (b8:af:67:63:a3:28)
Internet Protocol Version 4, Src: 172.24.31.204 (172.24.31.204), Dst: 130.245.255.4 (130.245.255.4)
User Datagram Protocol, Src Port: 36340 (36340), Dst Port: domain (53)
Domain Name System (query)
    [Response In: 24]
    Transaction ID: 0x8db2
    Flags: 0x0100 Standard query
    Questions: 1
    Answer RRs: 0
    Authority RRs: 0
    Additional RRs: 0
    Queries

No.     Time        Source                Destination           Protocol Length Info
     24 24.775852   130.245.255.4         172.24.31.204         DNS      154    Standard query response 0x8db2  A 173.194.123.81 A 173.194.123.80 A 173.194.123.82 A 173.194.123.83 A 173.194.123.84

Frame 24: 154 bytes on wire (1232 bits), 154 bytes captured (1232 bits)
Ethernet II, Src: Hewlett-_63:a3:28 (b8:af:67:63:a3:28), Dst: 30:10:b3:12:c8:2f (30:10:b3:12:c8:2f)
Internet Protocol Version 4, Src: 130.245.255.4 (130.245.255.4), Dst: 172.24.31.204 (172.24.31.204)
User Datagram Protocol, Src Port: domain (53), Dst Port: 36340 (36340)
Domain Name System (response)
    [Request In: 23]
    [Time: 0.001976000 seconds]
    Transaction ID: 0x8db2
    Flags: 0x8180 Standard query response, No error
    Questions: 1
    Answer RRs: 5
    Authority RRs: 0
    Additional RRs: 0
    Queries
    Answers

No.     Time        Source                Destination           Protocol Length Info
     25 24.776142   172.24.31.204         130.245.255.4         DNS      75     Standard query 0x4393  A www.gstatic.com

Frame 25: 75 bytes on wire (600 bits), 75 bytes captured (600 bits)
Ethernet II, Src: 30:10:b3:12:c8:2f (30:10:b3:12:c8:2f), Dst: Hewlett-_63:a3:28 (b8:af:67:63:a3:28)
Internet Protocol Version 4, Src: 172.24.31.204 (172.24.31.204), Dst: 130.245.255.4 (130.245.255.4)
User Datagram Protocol, Src Port: contentserver (3365), Dst Port: domain (53)
Domain Name System (query)
    [Response In: 26]
    Transaction ID: 0x4393
    Flags: 0x0100 Standard query
    Questions: 1
    Answer RRs: 0
    Authority RRs: 0
    Additional RRs: 0
    Queries

No.     Time        Source                Destination           Protocol Length Info
     26 24.778170   130.245.255.4         172.24.31.204         DNS      139    Standard query response 0x4393  A 173.194.123.95 A 173.194.123.88 A 173.194.123.79 A 173.194.123.87

Frame 26: 139 bytes on wire (1112 bits), 139 bytes captured (1112 bits)
Ethernet II, Src: Hewlett-_63:a3:28 (b8:af:67:63:a3:28), Dst: 30:10:b3:12:c8:2f (30:10:b3:12:c8:2f)
Internet Protocol Version 4, Src: 130.245.255.4 (130.245.255.4), Dst: 172.24.31.204 (172.24.31.204)
User Datagram Protocol, Src Port: domain (53), Dst Port: contentserver (3365)
Domain Name System (response)
    [Request In: 25]
    [Time: 0.002028000 seconds]
    Transaction ID: 0x4393
    Flags: 0x8180 Standard query response, No error
    Questions: 1
    Answer RRs: 4
    Authority RRs: 0
    Additional RRs: 0
    Queries
    Answers

No.     Time        Source                Destination           Protocol Length Info
     27 24.847470   172.24.31.204         173.194.123.81        TCP      74     42262 > https [SYN] Seq=0 Win=29200 Len=0 MSS=1460 SACK_PERM=1 TSval=14761295 TSecr=0 WS=128

Frame 27: 74 bytes on wire (592 bits), 74 bytes captured (592 bits)
Ethernet II, Src: 30:10:b3:12:c8:2f (30:10:b3:12:c8:2f), Dst: Hewlett-_63:a3:28 (b8:af:67:63:a3:28)
Internet Protocol Version 4, Src: 172.24.31.204 (172.24.31.204), Dst: 173.194.123.81 (173.194.123.81)
Transmission Control Protocol, Src Port: 42262 (42262), Dst Port: https (443), Seq: 0, Len: 0

No.     Time        Source                Destination           Protocol Length Info
     28 24.847830   172.24.31.204         173.194.123.65        TCP      74     37955 > https [SYN] Seq=0 Win=29200 Len=0 MSS=1460 SACK_PERM=1 TSval=14761295 TSecr=0 WS=128

Frame 28: 74 bytes on wire (592 bits), 74 bytes captured (592 bits)
Ethernet II, Src: 30:10:b3:12:c8:2f (30:10:b3:12:c8:2f), Dst: Hewlett-_63:a3:28 (b8:af:67:63:a3:28)
Internet Protocol Version 4, Src: 172.24.31.204 (172.24.31.204), Dst: 173.194.123.65 (173.194.123.65)
Transmission Control Protocol, Src Port: 37955 (37955), Dst Port: https (443), Seq: 0, Len: 0

No.     Time        Source                Destination           Protocol Length Info
     29 24.847970   172.24.31.204         173.194.123.65        TCP      74     37956 > https [SYN] Seq=0 Win=29200 Len=0 MSS=1460 SACK_PERM=1 TSval=14761295 TSecr=0 WS=128

Frame 29: 74 bytes on wire (592 bits), 74 bytes captured (592 bits)
Ethernet II, Src: 30:10:b3:12:c8:2f (30:10:b3:12:c8:2f), Dst: Hewlett-_63:a3:28 (b8:af:67:63:a3:28)
Internet Protocol Version 4, Src: 172.24.31.204 (172.24.31.204), Dst: 173.194.123.65 (173.194.123.65)
Transmission Control Protocol, Src Port: 37956 (37956), Dst Port: https (443), Seq: 0, Len: 0

No.     Time        Source                Destination           Protocol Length Info
     30 24.848151   172.24.31.204         173.194.123.79        TCP      74     34325 > https [SYN] Seq=0 Win=29200 Len=0 MSS=1460 SACK_PERM=1 TSval=14761295 TSecr=0 WS=128

Frame 30: 74 bytes on wire (592 bits), 74 bytes captured (592 bits)
Ethernet II, Src: 30:10:b3:12:c8:2f (30:10:b3:12:c8:2f), Dst: Hewlett-_63:a3:28 (b8:af:67:63:a3:28)
Internet Protocol Version 4, Src: 172.24.31.204 (172.24.31.204), Dst: 173.194.123.79 (173.194.123.79)
Transmission Control Protocol, Src Port: 34325 (34325), Dst Port: https (443), Seq: 0, Len: 0

No.     Time        Source                Destination           Protocol Length Info
     31 24.848212   172.24.31.204         173.194.123.79        TCP      74     34326 > https [SYN] Seq=0 Win=29200 Len=0 MSS=1460 SACK_PERM=1 TSval=14761295 TSecr=0 WS=128

Frame 31: 74 bytes on wire (592 bits), 74 bytes captured (592 bits)
Ethernet II, Src: 30:10:b3:12:c8:2f (30:10:b3:12:c8:2f), Dst: Hewlett-_63:a3:28 (b8:af:67:63:a3:28)
Internet Protocol Version 4, Src: 172.24.31.204 (172.24.31.204), Dst: 173.194.123.79 (173.194.123.79)
Transmission Control Protocol, Src Port: 34326 (34326), Dst Port: https (443), Seq: 0, Len: 0

No.     Time        Source                Destination           Protocol Length Info
     32 24.848362   172.24.31.204         173.194.123.81        TCP      74     42267 > https [SYN] Seq=0 Win=29200 Len=0 MSS=1460 SACK_PERM=1 TSval=14761295 TSecr=0 WS=128

Frame 32: 74 bytes on wire (592 bits), 74 bytes captured (592 bits)
Ethernet II, Src: 30:10:b3:12:c8:2f (30:10:b3:12:c8:2f), Dst: Hewlett-_63:a3:28 (b8:af:67:63:a3:28)
Internet Protocol Version 4, Src: 172.24.31.204 (172.24.31.204), Dst: 173.194.123.81 (173.194.123.81)
Transmission Control Protocol, Src Port: 42267 (42267), Dst Port: https (443), Seq: 0, Len: 0

No.     Time        Source                Destination           Protocol Length Info
     33 24.848419   172.24.31.204         173.194.123.81        TCP      74     42268 > https [SYN] Seq=0 Win=29200 Len=0 MSS=1460 SACK_PERM=1 TSval=14761295 TSecr=0 WS=128

Frame 33: 74 bytes on wire (592 bits), 74 bytes captured (592 bits)
Ethernet II, Src: 30:10:b3:12:c8:2f (30:10:b3:12:c8:2f), Dst: Hewlett-_63:a3:28 (b8:af:67:63:a3:28)
Internet Protocol Version 4, Src: 172.24.31.204 (172.24.31.204), Dst: 173.194.123.81 (173.194.123.81)
Transmission Control Protocol, Src Port: 42268 (42268), Dst Port: https (443), Seq: 0, Len: 0

No.     Time        Source                Destination           Protocol Length Info
     34 24.848477   172.24.31.204         173.194.123.81        TCP      74     42269 > https [SYN] Seq=0 Win=29200 Len=0 MSS=1460 SACK_PERM=1 TSval=14761295 TSecr=0 WS=128

Frame 34: 74 bytes on wire (592 bits), 74 bytes captured (592 bits)
Ethernet II, Src: 30:10:b3:12:c8:2f (30:10:b3:12:c8:2f), Dst: Hewlett-_63:a3:28 (b8:af:67:63:a3:28)
Internet Protocol Version 4, Src: 172.24.31.204 (172.24.31.204), Dst: 173.194.123.81 (173.194.123.81)
Transmission Control Protocol, Src Port: 42269 (42269), Dst Port: https (443), Seq: 0, Len: 0

No.     Time        Source                Destination           Protocol Length Info
     35 24.848535   172.24.31.204         173.194.123.81        TCP      74     42270 > https [SYN] Seq=0 Win=29200 Len=0 MSS=1460 SACK_PERM=1 TSval=14761295 TSecr=0 WS=128

Frame 35: 74 bytes on wire (592 bits), 74 bytes captured (592 bits)
Ethernet II, Src: 30:10:b3:12:c8:2f (30:10:b3:12:c8:2f), Dst: Hewlett-_63:a3:28 (b8:af:67:63:a3:28)
Internet Protocol Version 4, Src: 172.24.31.204 (172.24.31.204), Dst: 173.194.123.81 (173.194.123.81)
Transmission Control Protocol, Src Port: 42270 (42270), Dst Port: https (443), Seq: 0, Len: 0

No.     Time        Source                Destination           Protocol Length Info
     36 24.848587   172.24.31.204         173.194.123.81        TCP      74     42271 > https [SYN] Seq=0 Win=29200 Len=0 MSS=1460 SACK_PERM=1 TSval=14761295 TSecr=0 WS=128

Frame 36: 74 bytes on wire (592 bits), 74 bytes captured (592 bits)
Ethernet II, Src: 30:10:b3:12:c8:2f (30:10:b3:12:c8:2f), Dst: Hewlett-_63:a3:28 (b8:af:67:63:a3:28)
Internet Protocol Version 4, Src: 172.24.31.204 (172.24.31.204), Dst: 173.194.123.81 (173.194.123.81)
Transmission Control Protocol, Src Port: 42271 (42271), Dst Port: https (443), Seq: 0, Len: 0

No.     Time        Source                Destination           Protocol Length Info
     37 24.848744   172.24.31.204         173.194.123.95        TCP      74     49492 > https [SYN] Seq=0 Win=29200 Len=0 MSS=1460 SACK_PERM=1 TSval=14761295 TSecr=0 WS=128

Frame 37: 74 bytes on wire (592 bits), 74 bytes captured (592 bits)
Ethernet II, Src: 30:10:b3:12:c8:2f (30:10:b3:12:c8:2f), Dst: Hewlett-_63:a3:28 (b8:af:67:63:a3:28)
Internet Protocol Version 4, Src: 172.24.31.204 (172.24.31.204), Dst: 173.194.123.95 (173.194.123.95)
Transmission Control Protocol, Src Port: 49492 (49492), Dst Port: https (443), Seq: 0, Len: 0

No.     Time        Source                Destination           Protocol Length Info
     38 24.853020   173.194.123.81        172.24.31.204         TCP      74     https > 42262 [SYN, ACK] Seq=0 Ack=1 Win=42540 Len=0 MSS=1380 SACK_PERM=1 TSval=3557012459 TSecr=14761295 WS=128

Frame 38: 74 bytes on wire (592 bits), 74 bytes captured (592 bits)
Ethernet II, Src: Hewlett-_63:a3:28 (b8:af:67:63:a3:28), Dst: 30:10:b3:12:c8:2f (30:10:b3:12:c8:2f)
Internet Protocol Version 4, Src: 173.194.123.81 (173.194.123.81), Dst: 172.24.31.204 (172.24.31.204)
Transmission Control Protocol, Src Port: https (443), Dst Port: 42262 (42262), Seq: 0, Ack: 1, Len: 0

No.     Time        Source                Destination           Protocol Length Info
     39 24.853078   172.24.31.204         173.194.123.81        TCP      66     42262 > https [ACK] Seq=1 Ack=1 Win=29312 Len=0 TSval=14761296 TSecr=3557012459

Frame 39: 66 bytes on wire (528 bits), 66 bytes captured (528 bits)
Ethernet II, Src: 30:10:b3:12:c8:2f (30:10:b3:12:c8:2f), Dst: Hewlett-_63:a3:28 (b8:af:67:63:a3:28)
Internet Protocol Version 4, Src: 172.24.31.204 (172.24.31.204), Dst: 173.194.123.81 (173.194.123.81)
Transmission Control Protocol, Src Port: 42262 (42262), Dst Port: https (443), Seq: 1, Ack: 1, Len: 0

No.     Time        Source                Destination           Protocol Length Info
     40 24.853566   173.194.123.65        172.24.31.204         TCP      74     https > 37955 [SYN, ACK] Seq=0 Ack=1 Win=42540 Len=0 MSS=1380 SACK_PERM=1 TSval=1385724140 TSecr=14761295 WS=128

Frame 40: 74 bytes on wire (592 bits), 74 bytes captured (592 bits)
Ethernet II, Src: Hewlett-_63:a3:28 (b8:af:67:63:a3:28), Dst: 30:10:b3:12:c8:2f (30:10:b3:12:c8:2f)
Internet Protocol Version 4, Src: 173.194.123.65 (173.194.123.65), Dst: 172.24.31.204 (172.24.31.204)
Transmission Control Protocol, Src Port: https (443), Dst Port: 37955 (37955), Seq: 0, Ack: 1, Len: 0

No.     Time        Source                Destination           Protocol Length Info
     41 24.853599   172.24.31.204         173.194.123.65        TCP      66     37955 > https [ACK] Seq=1 Ack=1 Win=29312 Len=0 TSval=14761296 TSecr=1385724140

Frame 41: 66 bytes on wire (528 bits), 66 bytes captured (528 bits)
Ethernet II, Src: 30:10:b3:12:c8:2f (30:10:b3:12:c8:2f), Dst: Hewlett-_63:a3:28 (b8:af:67:63:a3:28)
Internet Protocol Version 4, Src: 172.24.31.204 (172.24.31.204), Dst: 173.194.123.65 (173.194.123.65)
Transmission Control Protocol, Src Port: 37955 (37955), Dst Port: https (443), Seq: 1, Ack: 1, Len: 0

No.     Time        Source                Destination           Protocol Length Info
     42 24.854202   173.194.123.79        172.24.31.204         TCP      74     https > 34325 [SYN, ACK] Seq=0 Ack=1 Win=42540 Len=0 MSS=1380 SACK_PERM=1 TSval=1385724140 TSecr=14761295 WS=128

Frame 42: 74 bytes on wire (592 bits), 74 bytes captured (592 bits)
Ethernet II, Src: Hewlett-_63:a3:28 (b8:af:67:63:a3:28), Dst: 30:10:b3:12:c8:2f (30:10:b3:12:c8:2f)
Internet Protocol Version 4, Src: 173.194.123.79 (173.194.123.79), Dst: 172.24.31.204 (172.24.31.204)
Transmission Control Protocol, Src Port: https (443), Dst Port: 34325 (34325), Seq: 0, Ack: 1, Len: 0

No.     Time        Source                Destination           Protocol Length Info
     43 24.854254   172.24.31.204         173.194.123.79        TCP      66     34325 > https [ACK] Seq=1 Ack=1 Win=29312 Len=0 TSval=14761296 TSecr=1385724140

Frame 43: 66 bytes on wire (528 bits), 66 bytes captured (528 bits)
Ethernet II, Src: 30:10:b3:12:c8:2f (30:10:b3:12:c8:2f), Dst: Hewlett-_63:a3:28 (b8:af:67:63:a3:28)
Internet Protocol Version 4, Src: 172.24.31.204 (172.24.31.204), Dst: 173.194.123.79 (173.194.123.79)
Transmission Control Protocol, Src Port: 34325 (34325), Dst Port: https (443), Seq: 1, Ack: 1, Len: 0

No.     Time        Source                Destination           Protocol Length Info
     44 24.854290   173.194.123.79        172.24.31.204         TCP      74     https > 34326 [SYN, ACK] Seq=0 Ack=1 Win=42540 Len=0 MSS=1380 SACK_PERM=1 TSval=1385835120 TSecr=14761295 WS=128

Frame 44: 74 bytes on wire (592 bits), 74 bytes captured (592 bits)
Ethernet II, Src: Hewlett-_63:a3:28 (b8:af:67:63:a3:28), Dst: 30:10:b3:12:c8:2f (30:10:b3:12:c8:2f)
Internet Protocol Version 4, Src: 173.194.123.79 (173.194.123.79), Dst: 172.24.31.204 (172.24.31.204)
Transmission Control Protocol, Src Port: https (443), Dst Port: 34326 (34326), Seq: 0, Ack: 1, Len: 0

No.     Time        Source                Destination           Protocol Length Info
     45 24.854303   172.24.31.204         173.194.123.79        TCP      66     34326 > https [ACK] Seq=1 Ack=1 Win=29312 Len=0 TSval=14761296 TSecr=1385835120

Frame 45: 66 bytes on wire (528 bits), 66 bytes captured (528 bits)
Ethernet II, Src: 30:10:b3:12:c8:2f (30:10:b3:12:c8:2f), Dst: Hewlett-_63:a3:28 (b8:af:67:63:a3:28)
Internet Protocol Version 4, Src: 172.24.31.204 (172.24.31.204), Dst: 173.194.123.79 (173.194.123.79)
Transmission Control Protocol, Src Port: 34326 (34326), Dst Port: https (443), Seq: 1, Ack: 1, Len: 0

No.     Time        Source                Destination           Protocol Length Info
     46 24.854315   173.194.123.65        172.24.31.204         TCP      74     https > 37956 [SYN, ACK] Seq=0 Ack=1 Win=42540 Len=0 MSS=1380 SACK_PERM=1 TSval=1384688519 TSecr=14761295 WS=128

Frame 46: 74 bytes on wire (592 bits), 74 bytes captured (592 bits)
Ethernet II, Src: Hewlett-_63:a3:28 (b8:af:67:63:a3:28), Dst: 30:10:b3:12:c8:2f (30:10:b3:12:c8:2f)
Internet Protocol Version 4, Src: 173.194.123.65 (173.194.123.65), Dst: 172.24.31.204 (172.24.31.204)
Transmission Control Protocol, Src Port: https (443), Dst Port: 37956 (37956), Seq: 0, Ack: 1, Len: 0

No.     Time        Source                Destination           Protocol Length Info
     47 24.854326   172.24.31.204         173.194.123.65        TCP      66     37956 > https [ACK] Seq=1 Ack=1 Win=29312 Len=0 TSval=14761296 TSecr=1384688519

Frame 47: 66 bytes on wire (528 bits), 66 bytes captured (528 bits)
Ethernet II, Src: 30:10:b3:12:c8:2f (30:10:b3:12:c8:2f), Dst: Hewlett-_63:a3:28 (b8:af:67:63:a3:28)
Internet Protocol Version 4, Src: 172.24.31.204 (172.24.31.204), Dst: 173.194.123.65 (173.194.123.65)
Transmission Control Protocol, Src Port: 37956 (37956), Dst Port: https (443), Seq: 1, Ack: 1, Len: 0

No.     Time        Source                Destination           Protocol Length Info
     48 24.854337   173.194.123.81        172.24.31.204         TCP      74     https > 42267 [SYN, ACK] Seq=0 Ack=1 Win=42540 Len=0 MSS=1380 SACK_PERM=1 TSval=1177692354 TSecr=14761295 WS=128

Frame 48: 74 bytes on wire (592 bits), 74 bytes captured (592 bits)
Ethernet II, Src: Hewlett-_63:a3:28 (b8:af:67:63:a3:28), Dst: 30:10:b3:12:c8:2f (30:10:b3:12:c8:2f)
Internet Protocol Version 4, Src: 173.194.123.81 (173.194.123.81), Dst: 172.24.31.204 (172.24.31.204)
Transmission Control Protocol, Src Port: https (443), Dst Port: 42267 (42267), Seq: 0, Ack: 1, Len: 0

No.     Time        Source                Destination           Protocol Length Info
     49 24.854350   172.24.31.204         173.194.123.81        TCP      66     42267 > https [ACK] Seq=1 Ack=1 Win=29312 Len=0 TSval=14761296 TSecr=1177692354

Frame 49: 66 bytes on wire (528 bits), 66 bytes captured (528 bits)
Ethernet II, Src: 30:10:b3:12:c8:2f (30:10:b3:12:c8:2f), Dst: Hewlett-_63:a3:28 (b8:af:67:63:a3:28)
Internet Protocol Version 4, Src: 172.24.31.204 (172.24.31.204), Dst: 173.194.123.81 (173.194.123.81)
Transmission Control Protocol, Src Port: 42267 (42267), Dst Port: https (443), Seq: 1, Ack: 1, Len: 0

No.     Time        Source                Destination           Protocol Length Info
     50 24.854362   173.194.123.81        172.24.31.204         TCP      74     https > 42269 [SYN, ACK] Seq=0 Ack=1 Win=42540 Len=0 MSS=1380 SACK_PERM=1 TSval=1385724140 TSecr=14761295 WS=128

Frame 50: 74 bytes on wire (592 bits), 74 bytes captured (592 bits)
Ethernet II, Src: Hewlett-_63:a3:28 (b8:af:67:63:a3:28), Dst: 30:10:b3:12:c8:2f (30:10:b3:12:c8:2f)
Internet Protocol Version 4, Src: 173.194.123.81 (173.194.123.81), Dst: 172.24.31.204 (172.24.31.204)
Transmission Control Protocol, Src Port: https (443), Dst Port: 42269 (42269), Seq: 0, Ack: 1, Len: 0

No.     Time        Source                Destination           Protocol Length Info
     51 24.854371   172.24.31.204         173.194.123.81        TCP      66     42269 > https [ACK] Seq=1 Ack=1 Win=29312 Len=0 TSval=14761296 TSecr=1385724140

Frame 51: 66 bytes on wire (528 bits), 66 bytes captured (528 bits)
Ethernet II, Src: 30:10:b3:12:c8:2f (30:10:b3:12:c8:2f), Dst: Hewlett-_63:a3:28 (b8:af:67:63:a3:28)
Internet Protocol Version 4, Src: 172.24.31.204 (172.24.31.204), Dst: 173.194.123.81 (173.194.123.81)
Transmission Control Protocol, Src Port: 42269 (42269), Dst Port: https (443), Seq: 1, Ack: 1, Len: 0

No.     Time        Source                Destination           Protocol Length Info
     52 24.854379   173.194.123.81        172.24.31.204         TCP      74     https > 42270 [SYN, ACK] Seq=0 Ack=1 Win=42540 Len=0 MSS=1380 SACK_PERM=1 TSval=1385734374 TSecr=14761295 WS=128

Frame 52: 74 bytes on wire (592 bits), 74 bytes captured (592 bits)
Ethernet II, Src: Hewlett-_63:a3:28 (b8:af:67:63:a3:28), Dst: 30:10:b3:12:c8:2f (30:10:b3:12:c8:2f)
Internet Protocol Version 4, Src: 173.194.123.81 (173.194.123.81), Dst: 172.24.31.204 (172.24.31.204)
Transmission Control Protocol, Src Port: https (443), Dst Port: 42270 (42270), Seq: 0, Ack: 1, Len: 0

No.     Time        Source                Destination           Protocol Length Info
     53 24.854386   172.24.31.204         173.194.123.81        TCP      66     42270 > https [ACK] Seq=1 Ack=1 Win=29312 Len=0 TSval=14761296 TSecr=1385734374

Frame 53: 66 bytes on wire (528 bits), 66 bytes captured (528 bits)
Ethernet II, Src: 30:10:b3:12:c8:2f (30:10:b3:12:c8:2f), Dst: Hewlett-_63:a3:28 (b8:af:67:63:a3:28)
Internet Protocol Version 4, Src: 172.24.31.204 (172.24.31.204), Dst: 173.194.123.81 (173.194.123.81)
Transmission Control Protocol, Src Port: 42270 (42270), Dst Port: https (443), Seq: 1, Ack: 1, Len: 0

No.     Time        Source                Destination           Protocol Length Info
     54 24.854394   173.194.123.95        172.24.31.204         TCP      74     https > 49492 [SYN, ACK] Seq=0 Ack=1 Win=42540 Len=0 MSS=1380 SACK_PERM=1 TSval=1385727932 TSecr=14761295 WS=128

Frame 54: 74 bytes on wire (592 bits), 74 bytes captured (592 bits)
Ethernet II, Src: Hewlett-_63:a3:28 (b8:af:67:63:a3:28), Dst: 30:10:b3:12:c8:2f (30:10:b3:12:c8:2f)
Internet Protocol Version 4, Src: 173.194.123.95 (173.194.123.95), Dst: 172.24.31.204 (172.24.31.204)
Transmission Control Protocol, Src Port: https (443), Dst Port: 49492 (49492), Seq: 0, Ack: 1, Len: 0

No.     Time        Source                Destination           Protocol Length Info
     55 24.854400   172.24.31.204         173.194.123.95        TCP      66     49492 > https [ACK] Seq=1 Ack=1 Win=29312 Len=0 TSval=14761296 TSecr=1385727932

Frame 55: 66 bytes on wire (528 bits), 66 bytes captured (528 bits)
Ethernet II, Src: 30:10:b3:12:c8:2f (30:10:b3:12:c8:2f), Dst: Hewlett-_63:a3:28 (b8:af:67:63:a3:28)
Internet Protocol Version 4, Src: 172.24.31.204 (172.24.31.204), Dst: 173.194.123.95 (173.194.123.95)
Transmission Control Protocol, Src Port: 49492 (49492), Dst Port: https (443), Seq: 1, Ack: 1, Len: 0

No.     Time        Source                Destination           Protocol Length Info
     56 24.854406   173.194.123.81        172.24.31.204         TCP      74     https > 42268 [SYN, ACK] Seq=0 Ack=1 Win=42540 Len=0 MSS=1380 SACK_PERM=1 TSval=1385723453 TSecr=14761295 WS=128

Frame 56: 74 bytes on wire (592 bits), 74 bytes captured (592 bits)
Ethernet II, Src: Hewlett-_63:a3:28 (b8:af:67:63:a3:28), Dst: 30:10:b3:12:c8:2f (30:10:b3:12:c8:2f)
Internet Protocol Version 4, Src: 173.194.123.81 (173.194.123.81), Dst: 172.24.31.204 (172.24.31.204)
Transmission Control Protocol, Src Port: https (443), Dst Port: 42268 (42268), Seq: 0, Ack: 1, Len: 0

No.     Time        Source                Destination           Protocol Length Info
     57 24.854412   172.24.31.204         173.194.123.81        TCP      66     42268 > https [ACK] Seq=1 Ack=1 Win=29312 Len=0 TSval=14761296 TSecr=1385723453

Frame 57: 66 bytes on wire (528 bits), 66 bytes captured (528 bits)
Ethernet II, Src: 30:10:b3:12:c8:2f (30:10:b3:12:c8:2f), Dst: Hewlett-_63:a3:28 (b8:af:67:63:a3:28)
Internet Protocol Version 4, Src: 172.24.31.204 (172.24.31.204), Dst: 173.194.123.81 (173.194.123.81)
Transmission Control Protocol, Src Port: 42268 (42268), Dst Port: https (443), Seq: 1, Ack: 1, Len: 0

No.     Time        Source                Destination           Protocol Length Info
     58 24.854418   173.194.123.81        172.24.31.204         TCP      74     https > 42271 [SYN, ACK] Seq=0 Ack=1 Win=42540 Len=0 MSS=1380 SACK_PERM=1 TSval=1385734374 TSecr=14761295 WS=128

Frame 58: 74 bytes on wire (592 bits), 74 bytes captured (592 bits)
Ethernet II, Src: Hewlett-_63:a3:28 (b8:af:67:63:a3:28), Dst: 30:10:b3:12:c8:2f (30:10:b3:12:c8:2f)
Internet Protocol Version 4, Src: 173.194.123.81 (173.194.123.81), Dst: 172.24.31.204 (172.24.31.204)
Transmission Control Protocol, Src Port: https (443), Dst Port: 42271 (42271), Seq: 0, Ack: 1, Len: 0

No.     Time        Source                Destination           Protocol Length Info
     59 24.854423   172.24.31.204         173.194.123.81        TCP      66     42271 > https [ACK] Seq=1 Ack=1 Win=29312 Len=0 TSval=14761296 TSecr=1385734374

Frame 59: 66 bytes on wire (528 bits), 66 bytes captured (528 bits)
Ethernet II, Src: 30:10:b3:12:c8:2f (30:10:b3:12:c8:2f), Dst: Hewlett-_63:a3:28 (b8:af:67:63:a3:28)
Internet Protocol Version 4, Src: 172.24.31.204 (172.24.31.204), Dst: 173.194.123.81 (173.194.123.81)
Transmission Control Protocol, Src Port: 42271 (42271), Dst Port: https (443), Seq: 1, Ack: 1, Len: 0

No.     Time        Source                Destination           Protocol Length Info
     60 24.854452   172.24.31.204         173.194.123.81        TLSv1.2  269    Client Hello

Frame 60: 269 bytes on wire (2152 bits), 269 bytes captured (2152 bits)
Ethernet II, Src: 30:10:b3:12:c8:2f (30:10:b3:12:c8:2f), Dst: Hewlett-_63:a3:28 (b8:af:67:63:a3:28)
Internet Protocol Version 4, Src: 172.24.31.204 (172.24.31.204), Dst: 173.194.123.81 (173.194.123.81)
Transmission Control Protocol, Src Port: 42262 (42262), Dst Port: https (443), Seq: 1, Ack: 1, Len: 203
Secure Sockets Layer

No.     Time        Source                Destination           Protocol Length Info
     61 24.854551   172.24.31.204         173.194.123.65        TLSv1.2  270    Client Hello

Frame 61: 270 bytes on wire (2160 bits), 270 bytes captured (2160 bits)
Ethernet II, Src: 30:10:b3:12:c8:2f (30:10:b3:12:c8:2f), Dst: Hewlett-_63:a3:28 (b8:af:67:63:a3:28)
